{
  "schema_version": "1.0.0",
  "id": "KNW-ARC-PROPAGATION",
  "version": "0.1.0",
  "title": {
    "ja": "訂正の配信網への反映と到達確認"
  },
  "lifecycle": "draft",
  "responsible_role": "訂正・評価・保存の設計と専門確認担当者",
  "authority": {
    "origin": "independent_proposal",
    "normative_class": "operational_proposal",
    "institutional_approval": "none",
    "applicability_note": "独立の運用試案。適用法令、契約、保存期間、編集権限及び組織の責任分担を案件ごとに確認する。"
  },
  "access": {
    "classification": "public",
    "may_share_with_external_ai": true
  },
  "sources": [
    {
      "source_id": "SRC-CROSSREF",
      "locator": "https://www.crossref.org/documentation/principles-practices/best-practices/versioning",
      "accessed_on": "2026-10-19",
      "verification_note": "Crossrefによる学術文献の版・訂正・撤回記録の指針。一般の広報物にDOI発行を義務付けるものではない。"
    }
  ],
  "links": [],
  "category": "standard",
  "scope": {
    "stages": [
      "08"
    ],
    "audiences": [
      "編集・訂正担当者",
      "科学的確認担当者",
      "保存担当者",
      "評価担当者"
    ]
  },
  "blocks": [
    {
      "id": "KNW-ARC-PROPAGATION-H1",
      "kind": "heading",
      "text": "対象と目的",
      "level": 2
    },
    {
      "id": "KNW-ARC-PROPAGATION-P1",
      "kind": "paragraph",
      "text": "同じ主張が本文、音声、動画、画像、短縮要約、SNS、報道提供資料に現れる場合は更新影響範囲を追う。"
    },
    {
      "id": "KNW-ARC-PROPAGATION-H2",
      "kind": "heading",
      "text": "記録と実施",
      "level": 2
    },
    {
      "id": "KNW-ARC-PROPAGATION-P2",
      "kind": "paragraph",
      "text": "改訂後のURL、投稿ID、各媒体の更新時刻、訂正表示の確認結果と未反映例外を記録する。"
    },
    {
      "id": "KNW-ARC-PROPAGATION-H3",
      "kind": "heading",
      "text": "解釈と判断の境界",
      "level": 2
    },
    {
      "id": "KNW-ARC-PROPAGATION-P3",
      "kind": "paragraph",
      "text": "既存の複製や検索キャッシュへの伝播を自動完了と推定しない。"
    }
  ]
}
