{
  "schema_version": "1.0.0",
  "id": "KNW-ARC-ARCHIVE",
  "version": "0.1.0",
  "title": {
    "ja": "保存パッケージと権利・アクセス管理"
  },
  "lifecycle": "draft",
  "responsible_role": "訂正・評価・保存の設計と専門確認担当者",
  "authority": {
    "origin": "independent_proposal",
    "normative_class": "operational_proposal",
    "institutional_approval": "none",
    "applicability_note": "独立の運用試案。適用法令、契約、保存期間、編集権限及び組織の責任分担を案件ごとに確認する。"
  },
  "access": {
    "classification": "public",
    "may_share_with_external_ai": true
  },
  "sources": [
    {
      "source_id": "SRC-NDSA",
      "locator": "https://www.ndsa.org/publications/levels-of-digital-preservation/",
      "accessed_on": "2026-10-19",
      "verification_note": "NDSA Levels of Digital Preservation、2026年版を含む保存能力評価の枠組み。保存媒体と費用に合わせ選択する。"
    },
    {
      "source_id": "SRC-LOC",
      "locator": "https://www.loc.gov/programs/digital-collections-management/inventory-and-custody/data-integrity-management/",
      "accessed_on": "2026-10-19",
      "verification_note": "米国議会図書館のデータ完全性管理方針。ファイル単位・集合単位の固定性管理の参考。"
    },
    {
      "source_id": "SRC-PPC",
      "locator": "https://www.ppc.go.jp/personalinfo/legal/guidelines_tsusoku/",
      "accessed_on": "2026-10-19",
      "verification_note": "個人情報保護委員会の通則ガイドライン。具体的な個人情報取扱い、保存期間及び適用法令の検証が必要。"
    }
  ],
  "links": [],
  "category": "standard",
  "scope": {
    "stages": [
      "08"
    ],
    "audiences": [
      "編集・訂正担当者",
      "科学的確認担当者",
      "保存担当者",
      "評価担当者"
    ]
  },
  "blocks": [
    {
      "id": "KNW-ARC-ARCHIVE-H1",
      "kind": "heading",
      "text": "対象と目的",
      "level": 2
    },
    {
      "id": "KNW-ARC-ARCHIVE-P1",
      "kind": "paragraph",
      "text": "保存は原本、公開派生物、修正通知、証跡、判断記録の関係を保持する。"
    },
    {
      "id": "KNW-ARC-ARCHIVE-H2",
      "kind": "heading",
      "text": "記録と実施",
      "level": 2
    },
    {
      "id": "KNW-ARC-ARCHIVE-P2",
      "kind": "paragraph",
      "text": "再公開可能性、第三者権利、個人情報、保持期限、廃棄義務と閲覧権限を別項目で管理する。"
    },
    {
      "id": "KNW-ARC-ARCHIVE-H3",
      "kind": "heading",
      "text": "解釈と判断の境界",
      "level": 2
    },
    {
      "id": "KNW-ARC-ARCHIVE-P3",
      "kind": "paragraph",
      "text": "永続保存を自動的に正当化せず、アクセス権と保存目的を定期的に見直す。"
    }
  ]
}
