{
  "schema_version": "1.0.0",
  "id": "KNW-ETH-ARC-ACCOUNTABILITY",
  "version": "0.1.0",
  "title": {
    "ja": "判断権限、利益相反及び異議申立て"
  },
  "lifecycle": "draft",
  "responsible_role": "訂正・評価・保存の設計と専門確認担当者",
  "authority": {
    "origin": "independent_proposal",
    "normative_class": "operational_proposal",
    "institutional_approval": "none",
    "applicability_note": "独立の運用試案。適用法令、契約、保存期間、編集権限及び組織の責任分担を案件ごとに確認する。"
  },
  "access": {
    "classification": "public",
    "may_share_with_external_ai": true
  },
  "sources": [
    {
      "source_id": "SRC-COPE",
      "locator": "https://doi.org/10.24318/cope.2019.1.4",
      "accessed_on": "2026-10-19",
      "verification_note": "COPE Retraction Guidelines、2025年改訂。学術雑誌の撤回指針を参照し、一般のウェブ記事への法的適用は想定しない。"
    }
  ],
  "links": [],
  "category": "ethics",
  "scope": {
    "stages": [
      "08"
    ],
    "audiences": [
      "編集・訂正担当者",
      "科学的確認担当者",
      "保存担当者",
      "評価担当者"
    ]
  },
  "blocks": [
    {
      "id": "KNW-ETH-ARC-ACCOUNTABILITY-H1",
      "kind": "heading",
      "text": "対象と目的",
      "level": 2
    },
    {
      "id": "KNW-ETH-ARC-ACCOUNTABILITY-P1",
      "kind": "paragraph",
      "text": "科学的妥当性を検討する者と公開判断を担う権限者の役割を記録する。"
    },
    {
      "id": "KNW-ETH-ARC-ACCOUNTABILITY-H2",
      "kind": "heading",
      "text": "記録と実施",
      "level": 2
    },
    {
      "id": "KNW-ETH-ARC-ACCOUNTABILITY-P2",
      "kind": "paragraph",
      "text": "利害関係や利益相反の可能性と再審査・異議申立て経路を記録する。"
    },
    {
      "id": "KNW-ETH-ARC-ACCOUNTABILITY-H3",
      "kind": "heading",
      "text": "解釈と判断の境界",
      "level": 2
    },
    {
      "id": "KNW-ETH-ARC-ACCOUNTABILITY-P3",
      "kind": "paragraph",
      "text": "チェックリスト完了や機械判定は実際の権限ある判断と区別する。"
    }
  ]
}
