{
  "schema_version": "1.0.0",
  "id": "KNW-ARC-TRIAGE",
  "version": "0.1.0",
  "title": {
    "ja": "影響と緊急度の評価"
  },
  "lifecycle": "draft",
  "responsible_role": "訂正・評価・保存の設計と専門確認担当者",
  "authority": {
    "origin": "independent_proposal",
    "normative_class": "operational_proposal",
    "institutional_approval": "none",
    "applicability_note": "独立の運用試案。適用法令、契約、保存期間、編集権限及び組織の責任分担を案件ごとに確認する。"
  },
  "access": {
    "classification": "public",
    "may_share_with_external_ai": true
  },
  "sources": [
    {
      "source_id": "SRC-COPE",
      "locator": "https://doi.org/10.24318/cope.2019.1.4",
      "accessed_on": "2026-10-19",
      "verification_note": "COPE Retraction Guidelines、2025年改訂。学術雑誌の撤回指針を参照し、一般のウェブ記事への法的適用は想定しない。"
    },
    {
      "source_id": "SRC-PPC",
      "locator": "https://www.ppc.go.jp/personalinfo/legal/guidelines_tsusoku/",
      "accessed_on": "2026-10-19",
      "verification_note": "個人情報保護委員会の通則ガイドライン。具体的な個人情報取扱い、保存期間及び適用法令の検証が必要。"
    }
  ],
  "links": [],
  "category": "standard",
  "scope": {
    "stages": [
      "08"
    ],
    "audiences": [
      "編集・訂正担当者",
      "科学的確認担当者",
      "保存担当者",
      "評価担当者"
    ]
  },
  "blocks": [
    {
      "id": "KNW-ARC-TRIAGE-H1",
      "kind": "heading",
      "text": "対象と目的",
      "level": 2
    },
    {
      "id": "KNW-ARC-TRIAGE-P1",
      "kind": "paragraph",
      "text": "誤記の重大さだけでなく、安全、個人情報、関係者の尊厳、波及先での意思決定への影響を評価する。"
    },
    {
      "id": "KNW-ARC-TRIAGE-H2",
      "kind": "heading",
      "text": "記録と実施",
      "level": 2
    },
    {
      "id": "KNW-ARC-TRIAGE-P2",
      "kind": "paragraph",
      "text": "影響範囲が不明な場合は不明と記し、訂正通知、暫定注意喚起、利用停止等の選択肢を検討する。"
    },
    {
      "id": "KNW-ARC-TRIAGE-H3",
      "kind": "heading",
      "text": "解釈と判断の境界",
      "level": 2
    },
    {
      "id": "KNW-ARC-TRIAGE-P3",
      "kind": "paragraph",
      "text": "緊急性の判定、暫定措置の提案、権限者による実際の決裁を分ける。"
    }
  ]
}
