{
  "schema_version": "1.0.0",
  "id": "KNW-ETH-PUB-ACCOUNTABILITY",
  "version": "0.1.0",
  "title": {
    "ja": "配信判断の責任と人間の最終確認"
  },
  "lifecycle": "draft",
  "responsible_role": "公開・配信業務の設計・審査担当者",
  "authority": {
    "origin": "independent_proposal",
    "normative_class": "operational_proposal",
    "institutional_approval": "none",
    "applicability_note": "独立の業務設計試案。実際の配信権限、契約、適用法令、プラットフォーム規約、障害対応手順は案件・媒体ごとに確認する。"
  },
  "access": {
    "classification": "public",
    "may_share_with_external_ai": true
  },
  "sources": [
    {
      "source_id": "SRC-RFC-9110",
      "locator": "https://www.rfc-editor.org/rfc/rfc9110.html",
      "accessed_on": "2026-10-19",
      "verification_note": "RFC 9110 HTTP Semantics。HTTP応答の技術的意味に限る。公開内容の正確性や許諾の規範ではない。"
    }
  ],
  "links": [],
  "category": "ethics",
  "scope": {
    "stages": [
      "07"
    ],
    "audiences": [
      "編集担当者",
      "配信担当者",
      "レビュアー",
      "公開責任者"
    ]
  },
  "blocks": [
    {
      "id": "KNW-ETH-PUB-ACCOUNTABILITY-H01",
      "kind": "heading",
      "text": "適用範囲と目的",
      "level": 2
    },
    {
      "id": "KNW-ETH-PUB-ACCOUNTABILITY-P01",
      "kind": "paragraph",
      "text": "公開の最終判断は権限ある担当者が行い、配信者がシステムの判定を実際の許可と解釈しない。"
    },
    {
      "id": "KNW-ETH-PUB-ACCOUNTABILITY-H02",
      "kind": "heading",
      "text": "実施上の確認事項",
      "level": 2
    },
    {
      "id": "KNW-ETH-PUB-ACCOUNTABILITY-P02",
      "kind": "paragraph",
      "text": "権限不足・保留・条件不一致を発見した者が停止を提起できる報告経路を整える。"
    },
    {
      "id": "KNW-ETH-PUB-ACCOUNTABILITY-H03",
      "kind": "heading",
      "text": "境界と判断事項",
      "level": 2
    },
    {
      "id": "KNW-ETH-PUB-ACCOUNTABILITY-P03",
      "kind": "paragraph",
      "text": "承認が与えられた理由と具体的な媒体範囲の記録を残し、誤配信時の原因究明を可能にする。"
    }
  ]
}
