{
  "schema_version": "1.0.0",
  "id": "KNW-WRT-ARCH",
  "version": "0.1.0",
  "title": {
    "ja": "記事構成・読者の理解順序の設計"
  },
  "lifecycle": "draft",
  "responsible_role": "編集担当者",
  "authority": {
    "origin": "independent_proposal",
    "normative_class": "operational_proposal",
    "institutional_approval": "none",
    "applicability_note": "汎用的な編集制作の独立設計案。媒体の役割、権利、組織規程、適用される法令は案件ごとに確認する。"
  },
  "access": {
    "classification": "public",
    "may_share_with_external_ai": true
  },
  "sources": [
    {
      "source_id": "SRC-BUNKA-PUBLIC-DOC",
      "locator": "https://www.bunka.go.jp/koho_hodo_oshirase/hodohappyo/93651301.html",
      "accessed_on": "2026-10-19",
      "verification_note": "文化庁による公用文作成の考え方（2022年）。法令本文には直接適用されない。読者や用途に応じた日本語の参考。"
    },
    {
      "source_id": "SRC-JPA-SCI-COMM",
      "locator": "https://psych.or.jp/jpamember/press_release_guidelines/",
      "accessed_on": "2026-10-19",
      "verification_note": "研究成果発表に関する日本心理学会の専門指針。因果と相関、統計量、引用、制約、過度の一般化の取扱い。"
    }
  ],
  "links": [],
  "category": "standard",
  "scope": {
    "stages": [
      "04"
    ],
    "audiences": [
      "編集担当者",
      "科学ライター",
      "制作担当者",
      "レビュー担当者"
    ]
  },
  "blocks": [
    {
      "id": "KNW-WRT-ARCH-H01",
      "kind": "heading",
      "text": "構成設計の目的",
      "level": 2
    },
    {
      "id": "KNW-WRT-ARCH-P01",
      "kind": "paragraph",
      "text": "文章の役割、対象読者、主要な問い、中心となる確認済みの事実を先に定める。導入、背景、方法、結果、解釈、限界、今後の課題が果たす説明機能を検討し、媒体の長さと読者に応じて組み立てる。"
    },
    {
      "id": "KNW-WRT-ARCH-H02",
      "kind": "heading",
      "text": "見出しと段落",
      "level": 2
    },
    {
      "id": "KNW-WRT-ARCH-P02",
      "kind": "paragraph",
      "text": "各段落に中心情報、根拠又は事例、前後とのつながりを持たせる。見出しは本文が答える範囲を超えて断定せず、読者が必要な箇所へ戻れる構造を作る。"
    },
    {
      "id": "KNW-WRT-ARCH-H03",
      "kind": "heading",
      "text": "読者への経路",
      "level": 2
    },
    {
      "id": "KNW-WRT-ARCH-P03",
      "kind": "paragraph",
      "text": "研究の歴史的経過を含める場合、観測・実験・解釈の時間順と、記事内での説明順を混同しない。関係する事実の発見と報道可能になった時点を分けて記す。"
    },
    {
      "id": "KNW-WRT-ARCH-H04",
      "kind": "heading",
      "text": "変更と検証",
      "level": 2
    },
    {
      "id": "KNW-WRT-ARCH-P04",
      "kind": "paragraph",
      "text": "編集上の説明順の変更により、因果、時間、対象範囲、引用の趣旨が変わる場合は原資料と照合して修正する。"
    }
  ]
}
