{
  "schema_version": "1.0.0",
  "id": "KNW-ETH-ARC-DIALOGUE",
  "version": "0.1.0",
  "title": {
    "ja": "異なる立場の解釈と対話の継続"
  },
  "lifecycle": "draft",
  "responsible_role": "訂正・評価・保存の設計と専門確認担当者",
  "authority": {
    "origin": "independent_proposal",
    "normative_class": "operational_proposal",
    "institutional_approval": "none",
    "applicability_note": "独立の運用試案。適用法令、契約、保存期間、編集権限及び組織の責任分担を案件ごとに確認する。"
  },
  "access": {
    "classification": "public",
    "may_share_with_external_ai": true
  },
  "sources": [
    {
      "source_id": "SRC-JPA",
      "locator": "https://psych.or.jp/jpamember/press_release_guidelines/",
      "accessed_on": "2026-10-19",
      "verification_note": "日本心理学会による科学的研究のプレスリリース指針。特定分野の参考とし、全領域を拘束するものではない。"
    }
  ],
  "links": [],
  "category": "ethics",
  "scope": {
    "stages": [
      "08"
    ],
    "audiences": [
      "編集・訂正担当者",
      "科学的確認担当者",
      "保存担当者",
      "評価担当者"
    ]
  },
  "blocks": [
    {
      "id": "KNW-ETH-ARC-DIALOGUE-H1",
      "kind": "heading",
      "text": "対象と目的",
      "level": 2
    },
    {
      "id": "KNW-ETH-ARC-DIALOGUE-P1",
      "kind": "paragraph",
      "text": "批判、専門的な異論、読者の質問には信頼性改善につながる情報が含まれ得る。"
    },
    {
      "id": "KNW-ETH-ARC-DIALOGUE-H2",
      "kind": "heading",
      "text": "記録と実施",
      "level": 2
    },
    {
      "id": "KNW-ETH-ARC-DIALOGUE-P2",
      "kind": "paragraph",
      "text": "意見とその証拠、利用者が置かれた文脈を分けて記録する。"
    },
    {
      "id": "KNW-ETH-ARC-DIALOGUE-H3",
      "kind": "heading",
      "text": "解釈と判断の境界",
      "level": 2
    },
    {
      "id": "KNW-ETH-ARC-DIALOGUE-P3",
      "kind": "paragraph",
      "text": "クリック数や多数派の感想によって少数者の影響を不可視化しない。"
    }
  ]
}
