{
  "schema_version": "1.0.0",
  "id": "KNW-PUB-DEPLOY",
  "version": "0.1.0",
  "title": {
    "ja": "公開操作、ログ及び撤回可能性"
  },
  "lifecycle": "draft",
  "responsible_role": "公開・配信業務の設計・審査担当者",
  "authority": {
    "origin": "independent_proposal",
    "normative_class": "operational_proposal",
    "institutional_approval": "none",
    "applicability_note": "独立の業務設計試案。実際の配信権限、契約、適用法令、プラットフォーム規約、障害対応手順は案件・媒体ごとに確認する。"
  },
  "access": {
    "classification": "public",
    "may_share_with_external_ai": true
  },
  "sources": [
    {
      "source_id": "SRC-RFC-9110",
      "locator": "https://www.rfc-editor.org/rfc/rfc9110.html",
      "accessed_on": "2026-10-19",
      "verification_note": "RFC 9110 HTTP Semantics。HTTP応答の技術的意味に限る。公開内容の正確性や許諾の規範ではない。"
    }
  ],
  "links": [],
  "category": "standard",
  "scope": {
    "stages": [
      "07"
    ],
    "audiences": [
      "編集担当者",
      "配信担当者",
      "レビュアー",
      "公開責任者"
    ]
  },
  "blocks": [
    {
      "id": "KNW-PUB-DEPLOY-H01",
      "kind": "heading",
      "text": "適用範囲と目的",
      "level": 2
    },
    {
      "id": "KNW-PUB-DEPLOY-P01",
      "kind": "paragraph",
      "text": "実行者・依頼者・確認者を区別し、実行ログには時刻、対象、媒体、結果を残す。"
    },
    {
      "id": "KNW-PUB-DEPLOY-H02",
      "kind": "heading",
      "text": "実施上の確認事項",
      "level": 2
    },
    {
      "id": "KNW-PUB-DEPLOY-P02",
      "kind": "paragraph",
      "text": "公開成功の通知と閲覧者から見た実際の表示は分けて確認する。"
    },
    {
      "id": "KNW-PUB-DEPLOY-H03",
      "kind": "heading",
      "text": "境界と判断事項",
      "level": 2
    },
    {
      "id": "KNW-PUB-DEPLOY-P03",
      "kind": "paragraph",
      "text": "ログに資格情報や不要な個人情報を混入させず、アクセス制御と保存期間を設計する。"
    }
  ]
}
